{
  "$schema": "https://json-schema.org/draft/2020-12/schema",
  "$id": "https://udos.dev/schemas/automation-job-contract.schema.json",
  "title": "uDOS Automation Job Contract",
  "type": "object",
  "required": [
    "version",
    "owner",
    "schema",
    "summary",
    "required_fields",
    "owners"
  ],
  "properties": {
    "version": {
      "const": "v2.0.4"
    },
    "owner": {
      "const": "uDOS-core"
    },
    "schema": {
      "const": "schemas/automation-job-contract.schema.json"
    },
    "summary": {
      "type": "string"
    },
    "required_fields": {
      "type": "array",
      "items": {
        "type": "string"
      },
      "minItems": 6
    },
    "owners": {
      "type": "object",
      "required": [
        "contract",
        "dispatching_consumers",
        "fulfillment_owner",
        "interpretation_consumer"
      ],
      "properties": {
        "contract": {
          "const": "uDOS-core"
        },
        "dispatching_consumers": {
          "type": "array",
          "items": {
            "type": "string"
          }
        },
        "fulfillment_owner": {
          "const": "uHOME-server"
        },
        "interpretation_consumer": {
          "const": "uDOS-gameplay"
        }
      },
      "additionalProperties": false
    }
  },
  "additionalProperties": false
}
