{
  "version": "v2.0.4",
  "owner": "uDOS-core",
  "schema": "schemas/automation-job-contract.schema.json",
  "summary": "Minimal automation dispatch contract for work queued into always-on runtimes.",
  "required_fields": [
    "job_id",
    "requested_capability",
    "payload_ref",
    "origin_surface",
    "policy_flags",
    "queued_at"
  ],
  "owners": {
    "contract": "uDOS-core",
    "dispatching_consumers": [
      "uDOS-wizard",
      "private-desktop-client"
    ],
    "fulfillment_owner": "uHOME-server",
    "interpretation_consumer": "uDOS-gameplay"
  }
}
